{
  "$schema": "neocortex-tool-manifest-v1.0",
  "version": "1.0.0",
  "generated_at": "2026-04-10T12:28:32.612607Z",
  "server_name": "neocortex",
  "tools": [
    {
      "name": "neocortex_cortex",
      "display_name": "Córtex Central",
      "description": "Acesso ao cortex central.",
      "category": "core",
      "version": "1.0.0",
      "actions": [
        {
          "name": "get_full",
          "description": "Retorna o conteudo completo do cortex",
          "parameters": {
            "action": {
              "type": "string",
              "description": "Parameter action",
              "required": true,
              "default": null
            },
            "section": {
              "type": "string",
              "description": "Parameter section",
              "required": false,
              "default": ""
            }
          },
          "returns": {
            "type": "object",
            "description": "JSON object with 'success' boolean and result data"
          }
        },
        {
          "name": "get_section",
          "description": "Retorna uma secao especifica",
          "parameters": {
            "action": {
              "type": "string",
              "description": "Parameter action",
              "required": true,
              "default": null
            },
            "section": {
              "type": "string",
              "description": "Parameter section",
              "required": false,
              "default": ""
            }
          },
          "returns": {
            "type": "object",
            "description": "JSON object with 'success' boolean and result data"
          }
        },
        {
          "name": "get_aliases",
          "description": "Retorna todos os aliases definidos",
          "parameters": {
            "action": {
              "type": "string",
              "description": "Parameter action",
              "required": true,
              "default": null
            },
            "section": {
              "type": "string",
              "description": "Parameter section",
              "required": false,
              "default": ""
            }
          },
          "returns": {
            "type": "object",
            "description": "JSON object with 'success' boolean and result data"
          }
        },
        {
          "name": "get_workflows",
          "description": "Retorna os workflows definidos",
          "parameters": {
            "action": {
              "type": "string",
              "description": "Parameter action",
              "required": true,
              "default": null
            },
            "section": {
              "type": "string",
              "description": "Parameter section",
              "required": false,
              "default": ""
            }
          },
          "returns": {
            "type": "object",
            "description": "JSON object with 'success' boolean and result data"
          }
        },
        {
          "name": "validate_alias",
          "description": "Valida se um alias esta correto",
          "parameters": {
            "action": {
              "type": "string",
              "description": "Parameter action",
              "required": true,
              "default": null
            },
            "section": {
              "type": "string",
              "description": "Parameter section",
              "required": false,
              "default": ""
            }
          },
          "returns": {
            "type": "object",
            "description": "JSON object with 'success' boolean and result data"
          }
        }
      ],
      "access_control": {
        "default_read": "authenticated",
        "default_write": "admin"
      },
      "metadata": {
        "module": "cortex",
        "action_count": 5
      }
    },
    {
      "name": "neocortex_lobes",
      "display_name": "Lobos",
      "description": "Gerenciamento de lobos.",
      "category": "core",
      "version": "1.0.0",
      "actions": [
        {
          "name": "list_active",
          "description": "Lista todos os lobos disponiveis",
          "parameters": {
            "action": {
              "type": "string",
              "description": "Parameter action",
              "required": true,
              "default": null
            },
            "lobe_name": {
              "type": "string",
              "description": "Parameter lobe_name",
              "required": false,
              "default": ""
            }
          },
          "returns": {
            "type": "object",
            "description": "JSON object with 'success' boolean and result data"
          }
        },
        {
          "name": "get_content",
          "description": "Retorna o conteudo de um lobe especifico",
          "parameters": {
            "action": {
              "type": "string",
              "description": "Parameter action",
              "required": true,
              "default": null
            },
            "lobe_name": {
              "type": "string",
              "description": "Parameter lobe_name",
              "required": false,
              "default": ""
            }
          },
          "returns": {
            "type": "object",
            "description": "JSON object with 'success' boolean and result data"
          }
        },
        {
          "name": "get_checkpoint_tree",
          "description": "Extrai a arvore de checkpoints de um lobe",
          "parameters": {
            "action": {
              "type": "string",
              "description": "Parameter action",
              "required": true,
              "default": null
            },
            "lobe_name": {
              "type": "string",
              "description": "Parameter lobe_name",
              "required": false,
              "default": ""
            }
          },
          "returns": {
            "type": "object",
            "description": "JSON object with 'success' boolean and result data"
          }
        },
        {
          "name": "activate",
          "description": "Marca um lobe como ativo (simulado)",
          "parameters": {
            "action": {
              "type": "string",
              "description": "Parameter action",
              "required": true,
              "default": null
            },
            "lobe_name": {
              "type": "string",
              "description": "Parameter lobe_name",
              "required": false,
              "default": ""
            }
          },
          "returns": {
            "type": "object",
            "description": "JSON object with 'success' boolean and result data"
          }
        },
        {
          "name": "deactivate",
          "description": "Marca um lobe como inativo (simulado)",
          "parameters": {
            "action": {
              "type": "string",
              "description": "Parameter action",
              "required": true,
              "default": null
            },
            "lobe_name": {
              "type": "string",
              "description": "Parameter lobe_name",
              "required": false,
              "default": ""
            }
          },
          "returns": {
            "type": "object",
            "description": "JSON object with 'success' boolean and result data"
          }
        }
      ],
      "access_control": {
        "default_read": "authenticated",
        "default_write": "admin"
      },
      "metadata": {
        "module": "lobes",
        "action_count": 5
      }
    },
    {
      "name": "neocortex_checkpoint",
      "display_name": "Checkpoint",
      "description": "Controle de checkpoints.",
      "category": "core",
      "version": "1.0.0",
      "actions": [
        {
          "name": "get_current",
          "description": "Retorna o checkpoint atual",
          "parameters": {
            "action": {
              "type": "string",
              "description": "Parameter action",
              "required": true,
              "default": null
            },
            "checkpoint_id": {
              "type": "string",
              "description": "Parameter checkpoint_id",
              "required": false,
              "default": ""
            },
            "description": {
              "type": "string",
              "description": "Parameter description",
              "required": false,
              "default": ""
            }
          },
          "returns": {
            "type": "object",
            "description": "JSON object with 'success' boolean and result data"
          }
        },
        {
          "name": "set_current",
          "description": "Define um novo checkpoint atual",
          "parameters": {
            "action": {
              "type": "string",
              "description": "Parameter action",
              "required": true,
              "default": null
            },
            "checkpoint_id": {
              "type": "string",
              "description": "Parameter checkpoint_id",
              "required": false,
              "default": ""
            },
            "description": {
              "type": "string",
              "description": "Parameter description",
              "required": false,
              "default": ""
            }
          },
          "returns": {
            "type": "object",
            "description": "JSON object with 'success' boolean and result data"
          }
        },
        {
          "name": "complete_task",
          "description": "Marca uma tarefa como completa",
          "parameters": {
            "action": {
              "type": "string",
              "description": "Parameter action",
              "required": true,
              "default": null
            },
            "checkpoint_id": {
              "type": "string",
              "description": "Parameter checkpoint_id",